{
  "country": "India",
  "country_code": "IN",
  "industry_group": "Diversified Financials",
  "kind": "stock",
  "listings": [
    {
      "currency": "INR",
      "exchange_mic": "XBOM",
      "symbol": "REPCOHOME.BO"
    }
  ],
  "market_cap_band": "Small Cap",
  "name": "Repco Home Finance Limited",
  "primary_symbol": "REPCOHOME.BO",
  "provenance": {
    "fetched_at": "2026-05-10T07:55:09Z",
    "license": "MIT",
    "source": "FinanceDatabase",
    "source_url": "https://github.com/JerBouma/FinanceDatabase"
  },
  "schema_version": "1.0.0",
  "sector": "Financials",
  "summary": "Repco Home Finance Limited is a housing finance company in India that provides home loans to individuals primarily in the self-employed segment. The company focuses on providing affordable housing finance options, especially in tier II and tier III cities. Repco Home Finance is headquartered in Chennai, India."
}
