{
  "country": "Korea, Republic of",
  "country_code": "KR",
  "industry_group": "Capital Goods",
  "kind": "stock",
  "listings": [
    {
      "currency": "KRW",
      "exchange_mic": "XKOS",
      "symbol": "079650.KQ"
    }
  ],
  "market_cap_band": "Micro Cap",
  "name": "Seosan Corporation",
  "primary_symbol": "079650.KQ",
  "provenance": {
    "fetched_at": "2026-05-17T08:09:19Z",
    "license": "MIT",
    "source": "FinanceDatabase",
    "source_url": "https://github.com/JerBouma/FinanceDatabase"
  },
  "schema_version": "1.0.0",
  "sector": "Industrials",
  "summary": "Seosan Corporation produces and sells concrete mixers in South Korea. It also offers fume pipes, connectors, files, ready-mixed concrete, square tubes, electric poles, high-strength piles, and other products. The company was founded in 1974 and is headquartered in Gwangju, South Korea.",
  "website": "http://www.seo-san.co.kr"
}
