{
  "country": "India",
  "country_code": "IN",
  "industry_group": "Retailing",
  "kind": "stock",
  "listings": [
    {
      "currency": "INR",
      "exchange_mic": "XBOM",
      "symbol": "V2RETAIL.BO"
    }
  ],
  "market_cap_band": "Micro Cap",
  "name": "V2 Retail Limited",
  "primary_symbol": "V2RETAIL.BO",
  "provenance": {
    "fetched_at": "2026-05-17T08:09:19Z",
    "license": "MIT",
    "source": "FinanceDatabase",
    "source_url": "https://github.com/JerBouma/FinanceDatabase"
  },
  "schema_version": "1.0.0",
  "sector": "Consumer Discretionary",
  "summary": "V2 Retail Limited is an Indian retail company operating a chain of fashion and lifestyle stores. They offer a range of apparel, footwear, accessories, and home furnishings. The company is headquartered in India."
}
