{
  "country": "China",
  "country_code": "CN",
  "industry": "Chemicals",
  "industry_group": "Materials",
  "kind": "stock",
  "listings": [
    {
      "currency": "CNY",
      "exchange_mic": "XSHE",
      "symbol": "300576.SZ"
    }
  ],
  "market_cap_band": "Small Cap",
  "name": "Shenzhen RongDa Photosensitive Science & Technology Co., Ltd.",
  "primary_symbol": "300576.SZ",
  "provenance": {
    "fetched_at": "2026-05-09T21:49:07Z",
    "license": "MIT",
    "source": "FinanceDatabase",
    "source_url": "https://github.com/JerBouma/FinanceDatabase"
  },
  "schema_version": "1.0.0",
  "sector": "Materials",
  "summary": "Shenzhen RongDa Photosensitive Science & Technology Co., Ltd. produces and sells photosensitive chemical materials in China. It offers PCB inks, positive photoresists, and special inks. The company was founded in 1996 and is headquartered in Shenzhen, China.",
  "website": "http://www.szrd.com"
}
