{
  "country": "United States",
  "country_code": "US",
  "industry": "Diversified Financial Services",
  "industry_group": "Diversified Financials",
  "kind": "stock",
  "listings": [
    {
      "currency": "USD",
      "exchange_mic": "XNYS",
      "symbol": "BBLG"
    }
  ],
  "market_cap_band": "Nano Cap",
  "name": "one",
  "primary_symbol": "BBLG",
  "provenance": {
    "fetched_at": "2026-05-09T21:49:07Z",
    "license": "MIT",
    "source": "FinanceDatabase",
    "source_url": "https://github.com/JerBouma/FinanceDatabase"
  },
  "schema_version": "1.0.0",
  "sector": "Financials",
  "summary": "one does not have significant operations. It intends to effect a merger, capital stock exchange, asset acquisition, stock purchase, reorganization, or other similar business combination with one or more operating businesses. The company was incorporated in 2020 and is based in San Francisco, California.",
  "website": "http://www.a-star.co"
}
