{
  "identifiers": {
    "composite_figi": "BBG00YJV31P3",
    "isin": "CA30317M1068"
  },
  "industry_group": "Materials",
  "isin": "CA30317M1068",
  "kind": "stock",
  "listings": [
    {
      "currency": "EUR",
      "exchange_mic": "XSTU",
      "symbol": "CA30317M1068.SG"
    }
  ],
  "name": "FABLED SILVER GOLD CORP-A",
  "primary_symbol": "CA30317M1068.SG",
  "provenance": {
    "fetched_at": "2026-05-17T08:09:19Z",
    "license": "MIT",
    "source": "FinanceDatabase",
    "source_url": "https://github.com/JerBouma/FinanceDatabase"
  },
  "schema_version": "1.0.0",
  "sector": "Materials",
  "summary": "FABLED SILVER GOLD CORP-A is a mineral exploration company focused on silver and gold properties in North America. The company actively explores for high-grade silver and gold deposits. Fabled Silver Gold is based in Vancouver, British Columbia, Canada."
}
