{
  "country": "United States",
  "country_code": "US",
  "industry": "Semiconductors & Semiconductor Equipment",
  "industry_group": "Semiconductors & Semiconductor Equipment",
  "kind": "stock",
  "listings": [
    {
      "currency": "USD",
      "exchange_mic": "XNYS",
      "symbol": "QRVO"
    }
  ],
  "market_cap_band": "Mid Cap",
  "name": "Qorvo, Inc.",
  "primary_symbol": "QRVO",
  "provenance": {
    "fetched_at": "2026-05-10T07:55:09Z",
    "license": "MIT",
    "source": "FinanceDatabase",
    "source_url": "https://github.com/JerBouma/FinanceDatabase"
  },
  "schema_version": "1.0.0",
  "sector": "Information Technology",
  "summary": "Qorvo, Inc. develops and commercializes technologies and products for wireless and wired connectivity worldwide. The company operates in two segments, Mobile Products, and Infrastructure and Defense Products. The company offers integrated modules incorporating switches, power amplifiers, filters and duplexers, antenna tuners, RF power management integrated circuits, multimode/multi-band PAs and transmit modules, antenna-plexers, discrete filters and duplexers, discrete switches, and UWB system solutions, as well as envelope tracking power management solutions, antenna control solutions, and UWB system solutions supporting secure, low power, location, and communication services. It also provides integrated solutions that include switch-LNA modules, variable gain amplifiers, and integrated PA Doherty modules for massive multiple-input/multiple-output systems; RF products and compound semiconductor foundry services to defense primes and other global defense and aerospace customers; Wi-Fi customer premises equipment, including power amplifiers, switches, low noise amplifiers, and bulk acoustic wave filters; system-on-a-chip hardware, firmware, and application software for smart home applications; automotive RF connectivity products and metal oxide semiconductor based UWB chip and module system solutions; and power application controllers and programmable analog power ICs. The company sells its products directly to original equipment manufacturers and original design manufacturers, as well as through a network of sales representative firms and distributors. Qorvo, Inc. was founded in 1957 and is headquartered in Greensboro, North Carolina.",
  "website": "http://www.qorvo.com"
}
