{
  "country": "United States",
  "country_code": "US",
  "identifiers": {
    "composite_figi": "BBG000V1Y6Q3",
    "cusip": "46121Y201",
    "figi": "BBG000V1Y843",
    "isin": "US46121Y2019"
  },
  "industry": "Construction Materials",
  "industry_group": "Materials",
  "isin": "US46121Y2019",
  "kind": "stock",
  "listings": [
    {
      "currency": "USD",
      "exchange_mic": "XNYS",
      "symbol": "IPI"
    },
    {
      "currency": "EUR",
      "exchange_mic": "XSTU",
      "symbol": "US46121Y2019.SG"
    }
  ],
  "market_cap_band": "Small Cap",
  "name": "Intrepid Potash, Inc.",
  "primary_symbol": "IPI",
  "provenance": {
    "fetched_at": "2026-05-17T08:09:19Z",
    "license": "MIT",
    "source": "FinanceDatabase",
    "source_url": "https://github.com/JerBouma/FinanceDatabase"
  },
  "schema_version": "1.0.0",
  "sector": "Materials",
  "summary": "Intrepid Potash, Inc. produces and sells potash and langbeinite products in the United States and internationally. It operates through three segments: Potash, Trio, and Oilfield Solutions. The Potash segment offers muriate of potash or potassium chloride for use as a fertilizer input in the agricultural market; as a component in drilling and fracturing fluids for oil and gas wells, as well as an input to other industrial processes in the industrial market; and as a nutrient supplement in the animal feed market. The Trio segment provides Trio, a specialty fertilizer that delivers potassium, sulfate, and magnesium in a single particle. The Oilfield Solutions segment sells water for use in the oil and gas services industry; and offers potassium chloride real-time mixing services on location for hydraulic fracturing operations and trucking services. The company offers salt for use in animal feeds, industrial applications, pool salts, and treatment of roads and walkways; magnesium chloride for use in the deicing and dedusting of roads; brines for well development and completion activities in the oil and gas industry; and metal recovery salt, a combination of potash and salt to enhance the recovery of aluminum in the aluminum recycling processing facilities. Intrepid Potash, Inc. was founded in 2000 and is based in Denver, Colorado.",
  "website": "http://www.intrepidpotash.com"
}
