{
  "country": "United States",
  "country_code": "US",
  "industry": "Health Care Technology",
  "industry_group": "Health Care Equipment & Services",
  "kind": "stock",
  "listings": [
    {
      "currency": "USD",
      "exchange_mic": "XNYS",
      "symbol": "TLIS"
    }
  ],
  "market_cap_band": "Nano Cap",
  "name": "Talis Biomedical Corporation",
  "primary_symbol": "TLIS",
  "provenance": {
    "fetched_at": "2026-05-09T21:49:07Z",
    "license": "MIT",
    "source": "FinanceDatabase",
    "source_url": "https://github.com/JerBouma/FinanceDatabase"
  },
  "schema_version": "1.0.0",
  "sector": "Health Care",
  "summary": "Talis Biomedical Corporation operates as a molecular diagnostic company. It is developing the Talis One system to address limitations of existing point-of-care diagnostic testing technologies for infectious diseases. The company is also developing Talis One assay kits for respiratory infections, infections related to women's health, and sexually transmitted infections; and other tests for the detection of other respiratory infections, such as a respiratory panel test to detect influenza A and influenza B plus SARS-CoV-2. Talis Biomedical Corporation was incorporated in 2013 and is headquartered in Menlo Park, California.",
  "website": "http://talis.bio"
}
