{
  "industry_group": "Energy",
  "kind": "stock",
  "listings": [
    {
      "currency": "EUR",
      "exchange_mic": "XSTU",
      "symbol": "TCD.SG"
    }
  ],
  "name": "Teekay Corp. Registered Shares",
  "primary_symbol": "TCD.SG",
  "provenance": {
    "fetched_at": "2026-05-10T07:55:09Z",
    "license": "MIT",
    "source": "FinanceDatabase",
    "source_url": "https://github.com/JerBouma/FinanceDatabase"
  },
  "schema_version": "1.0.0",
  "sector": "Energy",
  "summary": "Teekay Corporation is a provider of international crude oil and gas marine transportation services. The company operates through its subsidiaries, offering crude oil and gas transportation. The company is headquartered in Vancouver, Canada."
}
