{
  "country": "United States",
  "country_code": "US",
  "identifiers": {
    "composite_figi": "BBG000FL3011",
    "cusip": "96924N100",
    "figi": "BBG000FL3397",
    "isin": "US96924N1000"
  },
  "industry": "Construction & Engineering",
  "industry_group": "Commercial & Professional Services",
  "isin": "US96924N1000",
  "kind": "stock",
  "listings": [
    {
      "currency": "USD",
      "exchange_mic": "XNYS",
      "symbol": "J2A.BE"
    },
    {
      "currency": "USD",
      "exchange_mic": "XNYS",
      "symbol": "WLDN"
    },
    {
      "currency": "EUR",
      "exchange_mic": "XFRA",
      "symbol": "J2A.F"
    },
    {
      "currency": "EUR",
      "exchange_mic": "XSTU",
      "symbol": "J2A.SG"
    }
  ],
  "market_cap_band": "Small Cap",
  "name": "WILLDAN GROUP INC. DL-,01",
  "primary_symbol": "J2A.BE",
  "provenance": {
    "fetched_at": "2026-05-09T21:49:07Z",
    "license": "MIT",
    "source": "FinanceDatabase",
    "source_url": "https://github.com/JerBouma/FinanceDatabase"
  },
  "schema_version": "1.0.0",
  "sector": "Industrials",
  "summary": "Willdan Group, Inc. is a provider of professional technical and consulting services to utilities, government agencies, and private industry. The company offers a broad array of services including energy efficiency, engineering, and planning. Willdan Group is headquartered in Anaheim, California.",
  "website": "http://www.willdan.com"
}
