{
  "country": "Korea, Republic of",
  "country_code": "KR",
  "industry_group": "Health Care Equipment & Services",
  "kind": "stock",
  "listings": [
    {
      "currency": "KRW",
      "exchange_mic": "XKOS",
      "symbol": "347700.KQ"
    }
  ],
  "name": "LifeSemantics Corp.",
  "primary_symbol": "347700.KQ",
  "provenance": {
    "fetched_at": "2026-05-09T21:49:07Z",
    "license": "MIT",
    "source": "FinanceDatabase",
    "source_url": "https://github.com/JerBouma/FinanceDatabase"
  },
  "schema_version": "1.0.0",
  "sector": "Health Care",
  "summary": "LifeSemantics Corp., a digital health platform company, provides Internet-based health-related information services and solutions. It develops and commercializes LifeRecord, a digital health technology platform that provides artificial intelligence and information management technology, and a secure environment to collect, store, and exchange medical information in various ICT environments, as well as provides an environment in which individuals can manage their own personal health record data, such as EMR, genomic data, and lifelogs. The company was founded in 2012 and is based in Seoul, South Korea.",
  "website": "http://lifesemantics.kr"
}
