{
  "country": "United States",
  "country_code": "US",
  "industry": "Biotechnology",
  "industry_group": "Pharmaceuticals, Biotechnology & Life Sciences",
  "kind": "stock",
  "listings": [
    {
      "currency": "USD",
      "exchange_mic": "XNYS",
      "symbol": "HLVX"
    }
  ],
  "market_cap_band": "Micro Cap",
  "name": "HilleVax Inc. Common Stock",
  "primary_symbol": "HLVX",
  "provenance": {
    "fetched_at": "2026-05-10T07:55:09Z",
    "license": "MIT",
    "source": "FinanceDatabase",
    "source_url": "https://github.com/JerBouma/FinanceDatabase"
  },
  "schema_version": "1.0.0",
  "sector": "Health Care",
  "summary": "HilleVax, Inc. is a biopharmaceutical company focused on developing and commercializing novel vaccines. Their lead product candidate is a norovirus vaccine aimed at preventing acute gastroenteritis. HilleVax is headquartered in Boston, Massachusetts."
}
