{
  "country": "India",
  "country_code": "IN",
  "industry_group": "Utilities",
  "kind": "stock",
  "listings": [
    {
      "currency": "INR",
      "exchange_mic": "XBOM",
      "symbol": "JPPOWER.BO"
    }
  ],
  "market_cap_band": "Small Cap",
  "name": "Jaiprakash Power Ventures Limited",
  "primary_symbol": "JPPOWER.BO",
  "provenance": {
    "fetched_at": "2026-05-09T21:49:07Z",
    "license": "MIT",
    "source": "FinanceDatabase",
    "source_url": "https://github.com/JerBouma/FinanceDatabase"
  },
  "schema_version": "1.0.0",
  "sector": "Utilities",
  "summary": "Jaiprakash Power Ventures Limited is an Indian power generation company involved in the development and operation of power projects. The company's portfolio includes thermal and hydroelectric power plants."
}
