{
  "industry_group": "Materials",
  "kind": "stock",
  "listings": [
    {
      "currency": "USD",
      "exchange_mic": "XNYS",
      "symbol": "P5X.MU"
    }
  ],
  "name": "PUREPOINT URANIUM GRP",
  "primary_symbol": "P5X.MU",
  "provenance": {
    "fetched_at": "2026-05-09T21:49:07Z",
    "license": "MIT",
    "source": "FinanceDatabase",
    "source_url": "https://github.com/JerBouma/FinanceDatabase"
  },
  "schema_version": "1.0.0",
  "sector": "Materials",
  "summary": "Purepoint Uranium Group Inc. is a uranium exploration company focused on discovering and developing uranium resources in Canada. They acquire and explore properties with uranium potential, aiming to define economic deposits. The company is headquartered in Canada."
}
