{
  "country": "Australia",
  "country_code": "AU",
  "industry": "Capital Markets",
  "industry_group": "Diversified Financials",
  "kind": "stock",
  "listings": [
    {
      "currency": "AUD",
      "exchange_mic": "XASX",
      "symbol": "FGG.AX"
    }
  ],
  "market_cap_band": "Small Cap",
  "name": "Future Generation Global Investment Company Limited",
  "primary_symbol": "FGG.AX",
  "provenance": {
    "fetched_at": "2026-05-17T08:09:19Z",
    "license": "MIT",
    "source": "FinanceDatabase",
    "source_url": "https://github.com/JerBouma/FinanceDatabase"
  },
  "schema_version": "1.0.0",
  "sector": "Financials",
  "summary": "Future Generation Global Investment Company Limited is a closed-ended equity fund of funds launched by Wilson Asset Management (International) Pty Limited. The fund is co-managed by Antipodes Partners, Avenir Capital Pty Ltd, Cooper Investors Pty Limited, Eastspring Investments (Singapore) Limited, Ellerston Capital Pty Limited, Hunter Hall Investment Management Limited, Insync Funds Management Pty Limited, IronBridge Capital Management, L.P., Magellan Asset Management Limited, Manikay Partners, Morphic Asset Management Pty Limited, Neuberger Berman Australia Pty Limited, Nikko Asset Management Australia Limited, Optimal Fund Management Pty Limited, Paradice Investment Management Pty Ltd., Tribeca Investment Partners Pty Ltd., and VGI Partners Pty Limited. It invests in funds which invest in public equity markets across the globe. The fund seeks to invest in stocks of companies operating across diversified sectors. It primarily invests in other mutual funds which in turn invest in stocks of companies across all market capitalizations. The fund employs both quantitative and fundamental analysis with a combination of bottom-up and top-down stock selection approaches to create its portfolio. Future Generation Global Investment Company Limited was formed on July 10, 2015 and is domiciled in Australia.",
  "website": "http://www.futuregeninvest.com.au/Global/"
}
