{
  "industry_group": "Banks",
  "kind": "stock",
  "listings": [
    {
      "currency": "ZAR",
      "exchange_mic": "XJSE",
      "symbol": "NEWGBP.JO"
    }
  ],
  "name": "NewWave GBP Currency Exchange Traded Note",
  "primary_symbol": "NEWGBP.JO",
  "provenance": {
    "fetched_at": "2026-05-10T07:55:09Z",
    "license": "MIT",
    "source": "FinanceDatabase",
    "source_url": "https://github.com/JerBouma/FinanceDatabase"
  },
  "schema_version": "1.0.0",
  "sector": "Financials"
}
