{
  "kind": "stock",
  "listings": [
    {
      "currency": "EUR",
      "exchange_mic": "XWBO",
      "symbol": "AT0000A2PDZ5.VI"
    }
  ],
  "name": "RCB Bonus.Z./CA Immo 21-22",
  "primary_symbol": "AT0000A2PDZ5.VI",
  "provenance": {
    "fetched_at": "2026-05-10T07:55:09Z",
    "license": "MIT",
    "source": "FinanceDatabase",
    "source_url": "https://github.com/JerBouma/FinanceDatabase"
  },
  "schema_version": "1.0.0"
}
