{
  "country": "United States",
  "country_code": "US",
  "identifiers": {
    "composite_figi": "BBG000JMSSD4",
    "figi": "BBG000JMSWZ1"
  },
  "industry": "Banks",
  "industry_group": "Banks",
  "kind": "stock",
  "listings": [
    {
      "currency": "USD",
      "exchange_mic": "XNYS",
      "symbol": "UB5.MU"
    }
  ],
  "market_cap_band": "Large Cap",
  "name": "U.S. Bancorp",
  "primary_symbol": "UB5.MU",
  "provenance": {
    "fetched_at": "2026-05-10T07:55:09Z",
    "license": "MIT",
    "source": "FinanceDatabase",
    "source_url": "https://github.com/JerBouma/FinanceDatabase"
  },
  "schema_version": "1.0.0",
  "sector": "Financials",
  "summary": "U.S. Bancorp, a financial services holding company, provides various financial services in the United States. It operates in Corporate and Commercial Banking, Consumer and Business Banking, Wealth Management and Investment Services, Payment Services, and Treasury and Corporate Support segments. The company offers depository services, including checking accounts, savings accounts, and time certificate contracts; lending services, such as traditional credit products; and credit card services, lease financing and import/export trade, asset-backed lending, agricultural finance, and other products. It also provides ancillary services comprising capital markets, treasury management, and receivable lock-box collection services to corporate customers; and a range of asset management and fiduciary services for individuals, estates, foundations, business corporations, and charitable organizations. In addition, the company offers investment and insurance products to its customers principally within its markets, as well as fund administration services to a range of mutual and other funds. Further, it provides corporate and purchasing card, and corporate trust services; and merchant processing services, as well as cash and investment management, ATM processing, mortgage banking, and brokerage and leasing services. As of December 31, 2020, the company provided its products and services through a network of 2,434 banking offices principally operating in the Midwest and West regions of the United States, as well as through online services and over mobile devices; and operated a network of 4,232 ATMs. The company was founded in 1863 and is headquartered in Minneapolis, Minnesota.",
  "website": "http://www.usbank.com"
}
