{
  "country": "Netherlands",
  "country_code": "NL",
  "industry": "Diversified Telecommunication Services",
  "industry_group": "Telecommunication Services",
  "kind": "stock",
  "listings": [
    {
      "currency": "USD",
      "exchange_mic": "XNYS",
      "symbol": "VEON"
    }
  ],
  "market_cap_band": "Mid Cap",
  "name": "VEON Ltd.",
  "primary_symbol": "VEON",
  "provenance": {
    "fetched_at": "2026-05-10T07:55:09Z",
    "license": "MIT",
    "source": "FinanceDatabase",
    "source_url": "https://github.com/JerBouma/FinanceDatabase"
  },
  "schema_version": "1.0.0",
  "sector": "Communications",
  "summary": "VEON Ltd., through its subsidiaries, provides mobile and fixed-line telecommunications services. It offers voice, data, and other telecommunication services through a range of wireless, fixed, and broadband internet services. The company provides value added services, including short messages, multimedia messages, caller number identification, call waiting, data transmission, mobile internet, downloadable content, mobile finance services, machine-to-machine, and other services; national and international roaming services; wireless internet access and mobile financial services; and mobile bundles and call completion services. It also offers fixed-line telecommunication services, such as voice, data, internet, and value added services for corporations, operators, and consumers, as well as sells equipment and accessories. The company provides its services under the Beeline, Kyivstar, Jazz, Djezzy, and banglalink brands in Russia, Pakistan, Algeria, Uzbekistan, Ukraine, Bangladesh, Kazakhstan, Kyrgyzstan, and Georgia. It serves approximately 210 million customers. The company was formerly known as VimpelCom Ltd. and changed its name to VEON Ltd. in March 2017. VEON Ltd. was founded in 1992 and is headquartered in Amsterdam, the Netherlands.",
  "website": "http://www.veon.com"
}
