{
  "country": "Japan",
  "country_code": "JP",
  "industry": "Specialty Retail",
  "industry_group": "Retailing",
  "kind": "stock",
  "listings": [
    {
      "currency": "JPY",
      "exchange_mic": "XTKS",
      "symbol": "7501.T"
    }
  ],
  "market_cap_band": "Nano Cap",
  "name": "Tiemco Ltd.",
  "primary_symbol": "7501.T",
  "provenance": {
    "fetched_at": "2026-05-10T07:55:09Z",
    "license": "MIT",
    "source": "FinanceDatabase",
    "source_url": "https://github.com/JerBouma/FinanceDatabase"
  },
  "schema_version": "1.0.0",
  "sector": "Consumer Discretionary",
  "summary": "Tiemco Ltd. plans, develops, manufactures, imports, exports, and sells fishing tackle and outdoor products in Japan and internationally. Its fishing product includes fly hooks, fly tying tools and materials, fly rods and reels, leaders and tippet, and accessories; and bass rods and lures, saltwater rods and lures, trout rods and lures, and accessories. The company offers polarized sunglasses; and jackets, vests and packs, waders and gaiters, wading shoes, rain wear, shirts, cut and sewn products, pants, tights and socks, hats and caps, gloves, inflatable PFDs, bags and luggage, and accessories. It also operates a fly fishing school for saltwater. The company was founded in 1969 and is headquartered in Tokyo, Japan.",
  "website": "http://www.tiemco.co.jp"
}
