{
  "industry_group": "Consumer Services",
  "kind": "stock",
  "listings": [
    {
      "currency": "EUR",
      "exchange_mic": "XSTU",
      "symbol": "HE1.SG"
    }
  ],
  "name": "Hope Education Group Co. Ltd. R",
  "primary_symbol": "HE1.SG",
  "provenance": {
    "fetched_at": "2026-05-09T21:49:07Z",
    "license": "MIT",
    "source": "FinanceDatabase",
    "source_url": "https://github.com/JerBouma/FinanceDatabase"
  },
  "schema_version": "1.0.0",
  "sector": "Consumer Discretionary",
  "summary": "Hope Education Group Co. Ltd. is a Chinese company focused on providing higher education services, including universities and vocational colleges, primarily in China. The company offers courses and programs across various disciplines. Its headquarters are in China."
}
